Project ID,Organization,Department,Division,Project Number,Project Category,Project Type,Project Sub-Type,Phase,Priority,Status,Project Name,Description,Justification,Project Location,Notes,Council District,Estimated Start,Estimated End,Plan Cost,Estimated Cost,PO Cost,Actual Cost,Metro Cost,State Cost,Federal Cost,Other Cost,Total Cost,Longitude,Latitude,Layer Name,Mapped Location
8387,Metro Nashville,Metro Public Works,Engineering,23-110916191366,Guardrail,Guardrail Repairs,Maintenance/Repairs,Complete,,Complete,506 Ewing Drive,The wok will consist of: Remove and replace all damaged guardrail.,To address and resolve the following deficiencies: Damaged guardrail on the southwest corner of culvert.,506 Ewing Drive,Guardrail repairs will require traffic control measures.,"01, 02",11/20/2023,11/22/2023,0,14255,0,0,0,0,0,0,14255,-86.791445,36.231471,Project Line,POINT (-86.791445 36.231471)
8377,Metro Nashville,Metro Public Works,Engineering,23-102612310548,Sidewalk,New Sidewalk,New,Data Collection,,Planned,Moorewood Dr From Village Trl To Brickmont Dr,This project will increase walkability and pedestrian safety along Moorewood Dr.,To provide safe connections for people walking to neighborhoods and destinations for transportation and recreation.,Moorewood Dr From Village Trl To Brickmont Dr,Install new sidewalk on West side of Moorewood Dr from Village Trl to Brickmont Dr.,03,04/13/2024,06/11/2024,83250,83250,0,0,0,0,0,0,83250,-86.773044,36.247058,Project Line,POINT (-86.773044 36.247058)
8252,Metro Nashville,Metro Public Works,Engineering,23-032413330991,Guardrail,Guardrail Repairs,Maintenance/Repairs,Complete,,Complete,63rd Ave N over Briley Parkway,Guardrail Repairs: The work will consist of removing approximately 87.5 linear feet of damaged/substandard guardrail and replace for the safety of the traveling public. All Guardrail shall be installed to current TDOT Standards & Specifications.,"To address and resolve the following deficiencies: Due to the existing guardrail being damaged and posing a spearing hazard, the removal and replacement of all damaged guardrail is recommended.",63rd Ave N over Briley Parkway,The guardrail repair project has been prioritized for the safety of the traveling public.,20,11/13/2023,11/17/2023,0,18000,0,0,0,0,0,0,18000,-86.867006,36.164319,Project Line,POINT (-86.867006 36.164319)
8365,Metro Nashville,Metro Public Works,Engineering,23-102013492655,Sidewalk,New Sidewalk,New,Data Collection,,Planned,Village Trail From Brick Church Pike To Moorewood Dr,New 5' sidewalk on south side of Village Trail.,To provide safe connections for people walking to neighborhoods and destinations for transportation and recreation.,Village Trail From Brick Church Pike To Moorewood Dr,This project is currently in planning.,03,04/13/2024,07/11/2024,342000,342000,0,0,0,0,0,0,342000,-86.773196,36.247444,Project Line,POINT (-86.773196 36.247444)
8374,Metro Nashville,Metro Public Works,Engineering,23-102611235466,Sidewalk,New Sidewalk,New,Data Collection,,Planned,Rowan Dr From Buena Vista Pk To Revels Dr,This project will increase walkability and pedestrian safety on Rowan Dr between Buena Vista Pk and Revels Dr.,To provide safe connections for people walking to neighborhoods and destinations for transportation and recreation.,Rowan Dr From Buena Vista Pk To Revels Dr,Install new sidewalk on South side of Rowan Dr from Buena Vista Pk to Revels Dr.,02,04/13/2024,06/11/2024,882000,882000,0,0,0,0,0,0,882000,-86.813524,36.219671,Project Line,POINT (-86.813524 36.219671)
8393,Metro Nashville,Metro Public Works,Engineering,23-110919264537,Guardrail,Guardrail Repairs,Maintenance/Repairs,Complete,,Complete,Bear Hollow Road/ Earthman Fork,The wok will consist of: Remove and replace all damaged guardrail.,To address and resolve the following deficiencies: Damaged guardrail on the northeast scorner of the bridge.,Bear Hollow Road/ Earthman Fork,Guardrail repairs will require traffic control measures.,01,11/13/2023,11/17/2023,0,11903,0,0,0,0,0,0,11903,-86.857161,36.300263,Project Poly,POINT (-86.857161 36.300263)
6849,Metro Nashville,Metro Public Works,Engineering,21-022309195913,Culvert,Culvert Replacement,Replacement,Under Construction,,In Progress,305 Walton Lane,"Risk of Structural Failure:  Culvert Replacement Project - The work will consist of replacing the existing 30"" corrugated metal pipe culverts by a reinforced concrete slab bridge. Additional work will consist of inlet and outlet channel stabilization, embankments stabilization, and inlet and outlet wingwalls. Ancillary components and services such as traffic safety features and utility coordination will also be determined at project initiation.","To address and resolve the following deficiencies: Culvert has 100% section loss, seam separation, asphalt cracking, destabilized headwalls, and embankment erosion.  The structure was rated ""poor"" (2 out of 9) during the latest condition assessment.  Replacement is needed to avoid potential roadway failure.",305 Walton Lane,This project was initiated due to poor condition. Culvert replacement will require traffic control measures.,07,10/02/2023,02/02/2024,497840,414676,0,0,0,0,0,0,414676,-86.732856,36.239636,Project Point,POINT (-86.732856 36.239636)
8388,Metro Nashville,Metro Public Works,Engineering,23-110916273074,Guardrail,Guardrail Repairs,Maintenance/Repairs,Complete,,Complete,Rhine Drive at Port Drive,The wok will consist of: Remove and replace all damaged guardrail.,To address and resolve the following deficiencies: Damaged guardrail at the southeast corner of the intersection.,Rhine Drive at Port Drive,Guardrail repairs will require traffic control measures.,03,11/20/2023,11/22/2023,0,31976,0,0,0,0,0,0,31976,-86.741914,36.257166,Project Line,POINT (-86.741914 36.257166)
8376,Metro Nashville,Metro Public Works,Engineering,23-102612025748,Sidewalk,New Sidewalk,New,Data Collection,,Planned,Brickmont Dr From Moorewood Dr To Chesapeake Dr,This project will increase walkability and pedestrian safety along Brickmont Dr.,To provide safe connections for people walking to neighborhoods and destinations for transportation and recreation.,Brickmont Dr From Moorewood Dr To Chesapeake Dr,Install new sidewalk on South side of Brickmont Dr from Moorewood Dr to Chesapeake Dr.,03,04/13/2024,06/11/2024,306000,306000,0,0,0,0,0,0,306000,-86.769237,36.245958,Project Line,POINT (-86.769237 36.245958)
8375,Metro Nashville,Metro Public Works,Engineering,23-102611440034,Sidewalk,New Sidewalk,New,Data Collection,,Planned,Chesapeake Dr From Brickmont Dr To Doverside Dr,This project will increase walkability and pedestrian safety along Chesapeake Dr.,To provide safe connections for people walking to neighborhoods and destinations for transportation and recreation.,Chesapeake Dr From Brickmont Dr To Doverside Dr,Install new sidewalk on West side of Chesapeake Dr from Brickmont Dr to Doverside Dr.,03,04/13/2024,06/11/2024,390375,390375,0,0,0,0,0,0,390375,-86.767623,36.24354,Project Line,POINT (-86.767623 36.24354)
8373,Metro Nashville,Metro Public Works,Engineering,23-102611053415,Sidewalk,New Sidewalk,New,Data Collection,,Planned,Revels Dr From Rowan Dr To Whites Creek Pk,This project will increase walkability and pedestrian safety along Revels Dr.,To provide safe connections for people walking to neighborhoods and destinations for transportation and recreation.,Revels Dr From Rowan Dr To Whites Creek Pk,Install new sidewalk on South side of Revels Dr from Rowan Dr to Whites Creek Pk.,02,04/13/2024,06/11/2024,328500,328500,0,0,0,0,0,0,328500,-86.806266,36.221225,Project Line,POINT (-86.806266 36.221225)
7280,Metro Nashville,Metro Public Works,Engineering,21-093014204877,Bridge,Bridge Repairs,Maintenance/Repairs,Plan Design,,Planned,Walton Lane/CSXT Railroad,"BRIDGE REPAIRS identified by TDOT Bridge Maintenance Division - The work will require coordination with CSXT Railroad. Repairs needed to address concrete cracks on bents and abutments greater than 1/4"", concrete spalls on bents and abutments, erosion under abutment footing.","To address and resolve the following deficiencies: Concrete cracks on bents and abutments greater than 1/4"", concrete spalls on bents and abutments, erosion under abutment footing.",Walton Lane/CSXT Railroad,The bridge repairs will require the traffic controls measures.,07,02/05/2024,05/03/2024,750000,0,0,0,0,0,0,0,750000,-86.727468,36.239129,Project Poly,POINT (-86.727468 36.239129)
8310,Metro Nashville,Metro Public Works,Engineering,23-060212054841,Bridge,Bridge Repairs,Maintenance/Repairs,Under Construction,,In Progress,Park Court/ Sorghum Branch,"Flagged - NDOT. The work will consist of: Repair concrete deterioration on the bridge deck and abutments, install epoxy seal coat on the bridge deck.","The 2021 TDOT inspection identified concrete cracks in top of bridge deck, and concrete spalls in bridge abutments.",Park Court/ Sorghum Branch,Traffic control measures will be required to complete the planned bridge repairs.,27,09/18/2023,01/05/2024,0,88000,0,0,0,0,0,0,88000,-86.707461,36.059015,Project Poly,POINT (-86.707461 36.059015)
8297,Metro Nashville,Metro Public Works,Engineering,23-060116182277,Bridge,Bridge Repairs,Maintenance/Repairs,Under Construction,,In Progress,Edmondson Pike/ Branch,"Flagged - NDOT. The work will consist of: Repair concrete deterioration on the bridge deck and wingwalls, install epoxy seal coat on the bridge deck.","The 2021 TDOT inspection identified concrete cracks and spalls on the bridge deck, concrete spalls with exposed steel on the northwestern wingwall.",Edmondson Pike/ Branch,Traffic control measures will be required to complete the planned bridge repairs.,"26, 04",09/18/2023,01/05/2024,0,121000,0,0,0,0,0,0,121000,-86.74333,36.050814,Project Poly,POINT (-86.74333 36.050814)
8298,Metro Nashville,Metro Public Works,Engineering,23-060116300943,Bridge,Bridge Repairs,Maintenance/Repairs,Under Construction,,In Progress,Dodson Chapel Road/ Branch,"Flagged - NDOT. The work will consist of: Repair concrete deterioration on the bridge deck, install epoxy seal coat on the bridge deck, remove sediment from bridge barrels.","The 2021 TDOT inspection identified concrete cracks on the bridge deck, sediment buildup in the bridge barrels.",Dodson Chapel Road/ Branch,Traffic control measures will be required to complete the planned bridge repairs.,14,09/25/2023,01/05/2024,0,175000,0,0,0,0,0,0,175000,-86.613635,36.178766,Project Poly,POINT (-86.613635 36.178766)
8307,Metro Nashville,Metro Public Works,Engineering,23-060211463500,Bridge,Bridge Repairs,Maintenance/Repairs,Under Construction,,In Progress,Brick Church Pike/ Branch,"Flagged - NDOT. The work will consist of: Repair concrete spalls, repair scour under the abutment and pier footers, repair concrete deterioration on the bridge deck, install epoxy seal coat on the bridge deck.","The 2021 TDOT inspection identified concrete spall and cracks on abutments, concrete pop outs and cracks in the bridge deck, scour under the abutments and piers footers.",Brick Church Pike/ Branch,Traffic control measures will be required to complete the planned bridge repairs.,10,09/18/2023,01/05/2024,0,336000,0,0,0,0,0,0,336000,-86.730784,36.330949,Project Poly,POINT (-86.730784 36.330949)
8309,Metro Nashville,Metro Public Works,Engineering,23-060212014447,Bridge,Bridge Repairs,Maintenance/Repairs,Under Construction,,In Progress,Andrew Jackson Parkway/Dry Fork Creek,"Flagged - NDOT. The work will consist of: Repair concrete deterioration on the bridge deck, install epoxy seal coat on the bridge deck, repair riprap failure.",The 2021 TDOT inspection identified concrete cracks on the bridge deck and riprap failure.,Andrew Jackson Parkway/Dry Fork Creek,Traffic control measures will be required to complete the planned bridge repairs.,14,10/02/2023,01/05/2024,0,333000,0,0,0,0,0,0,333000,-86.609779,36.185061,Project Poly,POINT (-86.609779 36.185061)
7812,Metro Nashville,Metro Public Works,Engineering,22-082514585358,Bridge,Bridge Repairs,Maintenance/Repairs,Under Construction,,In Progress,Knight Drive/ Ewing Creek,"Guardrail Repair: The work will consist of removing all damaged guardrail, installing 87.5' of single guardrail type 2, 1-type 13 guardrail anchor, guardrail transition, 62.5' of radius rail, repair roadway deterioration with new asphalt, remove debris buildup on bridge deck, clear debris from clogged drains.","To address and resolve the following deficiencies: Damaged guardrail, roadway deterioration, debris buildup on bridge deck, clogged drains",Knight Drive/ Ewing Creek,Bridge repairs will require traffic control measures.,"01, 02",02/06/2023,04/05/2024,0,128376,129430.93,129430.93,0,0,0,0,129430.93,-86.803907,36.231901,Project Poly,POINT (-86.803907 36.231901)
6787,Metro Nashville,Metro Public Works,Engineering,21-021815433076,Culvert,Culvert Replacement,Replacement,Under Construction,,In Progress,2926 Melvin Road,"Risk of Structural Failure:  Culvert Replacement Project - The work will consist of replacing the existing 16'x7' Timber Framed Bridge with a TDOT Reinforced Concrete Slab Bridge. Additional work will consist of inlet and outlet channel stabilization, embankments stabilization, and inlet and outlet wingwalls. Ancillary components and services such as traffic safety features and utility coordination will also be determined at project initiation.","To address and resolve the following deficiencies: Culvert has rotten timber that frame the structure as well as corrosive section loss in the steel I-Beams, delaminated concrete on the deck, and evidence of overtopping.  The structure was rated ""Critical"" (2 out of 9) during the latest condition assessment.  Replacement is needed to avoid potential roadway failure.",2926 Melvin Road,This project was initiated due to poor condition. Culvert replacement will require traffic control measures.,12,2023,2024,1524000,1935480,773694.06,0,1524000,0,0,0,1935480,-86.571859,36.174224,Project Point,POINT (-86.571859 36.174224)
7521,Metro Nashville,Metro Public Works,Engineering,22-022312423911,Bikeway,Protected Bike Lane,New,Plan Design,,Planned,Dr Walter S Davis Blvd From 39th Ave N To Ed Temple Blvd,This project is anticipated to provide a new protected cycletrack.,To provide safe connections for people biking to neighborhoods and destinations for transportation and recreation.,Dr Walter S Davis Blvd From 39th Ave N To Ed Temple Blvd,Project is currently in design.,21,"Jan, 2024","Jul, 2024",489273.35,1356792.77,0,0,0,0,0,0,1356792.77,-86.830937,36.171486,Project Line,POINT (-86.830937 36.171486)
7369,Metro Nashville,Metro Public Works,Paving,RPMS-49056,Paving,Paving,New,Complete,,Complete,BAKERTOWN RD - EZELL RD/OVERYBY DR - HAYWOOD LN,"Based on the current condition index, this roadway segment qualifies for paving.","Based on the current condition index, this roadway segment qualifies for paving.",BAKERTOWN RD - EZELL RD/OVERYBY DR - HAYWOOD LN,"Based on the current condition index, this roadway segment qualifies for paving.",28,01/01/2023,01/31/2023,147250,0,0,0,0,0,0,0,147250,-86.689166,36.072256,Project Line,POINT (-86.689166 36.072256)
5683,Metro Nashville,Metro Public Works,Paving,RPMS-18616,Paving,Paving,New,Complete,,Complete,OVERCREST DR - HARDING PL - BLACKMAN RD,OVERCREST DR - HARDING PL - BLACKMAN RD,"Based on the current condiion index, this roadway segment qualifies for paving",OVERCREST DR - HARDING PL - BLACKMAN RD,PAVING PROJECT: 'OVERCREST DR - HARDING PL - BLACKMAN RD',26,01/01/2023,01/31/2023,52250,0,0,0,52250,0,0,0,52250,-86.734468,36.07576,Project Line,POINT (-86.734468 36.07576)
815,Metro Nashville,Metro Public Works,Paving,RPMS-11162,Paving,Paving,New,Complete,,Complete,OVERCREST CT - OVERCREST DR - CUL-DE-SAC,OVERCREST CT - OVERCREST DR - CUL-DE-SAC,"Based on the current condiion index, this roadway segment qualifies for paving",OVERCREST CT - OVERCREST DR - CUL-DE-SAC,PAVING PROJECT: 'OVERCREST CT - OVERCREST DR - CUL-DE-SAC',26,01/01/2023,01/31/2023,11050,0,0,0,11050,0,0,0,11050,-86.735042,36.075257,Project Line,POINT (-86.735042 36.075257)
832,Metro Nashville,Metro Public Works,Paving,RPMS-11204,Paving,Paving,New,Complete,,Complete,HAYSTACK LN - ANTIOCH PK - BAKERTOWN RD,HAYSTACK LN - ANTIOCH PK - BAKERTOWN RD,"Based on the current condiion index, this roadway segment qualifies for paving",HAYSTACK LN - ANTIOCH PK - BAKERTOWN RD,HAYSTACK LN - ANTIOCH PK - BAKERTOWN RD,28,01/01/2023,01/31/2023,32300,0,0,0,32300,0,0,0,32300,-86.685558,36.071602,Project Line,POINT (-86.685558 36.071602)
8384,Metro Nashville,Metro Public Works,Engineering,23-110714011260,Sidewalk,New Sidewalk,New,Data Collection,,Planned,Albion St under RR Bridge,This project will close sidewalk gaps on Albion St under the RR Bridge.,To provide safe connections for people walking to neighborhoods and destinations for transportation and recreation.,Albion St under RR Bridge,Project is currently in Council readings,21,02/27/2024,04/29/2024,200000,0,0,0,0,0,0,0,200000,-86.809793,36.165721,Project Line,POINT (-86.809793 36.165721)
7368,Metro Nashville,Metro Public Works,Paving,RPMS-49057,Paving,Paving,New,Complete,,Complete,EZELL RD - OVERBY DR - ANTIOCH PIKE,"Based on the current condition index, this roadway segment qualifies for paving.","Based on the current condition index, this roadway segment qualifies for paving.",EZELL RD - OVERBY DR - ANTIOCH PIKE,"Based on the current condition index, this roadway segment qualifies for paving.",28,01/01/2023,01/31/2023,150100,0,0,0,0,0,0,0,150100,-86.689144,36.082992,Project Line,POINT (-86.689144 36.082992)
5278,Metro Nashville,Metro Public Works,Engineering,2016-R-007,Sidewalk,New Sidewalk,New,Aquiring Right-Of-Way,,Planned,Blue Hole Road,"Sidewalk, curb & gutter, and grass strip",Provides sidewalk network connectivity to Henry C. Maxwell Elementary School,Blue Hole Rd From Henry Maxwell Elementary School To Blue Hole Way,"Installation of new sidewalk along with curb, gutter, and storm drainage that provides sidewalk network connectivity to Henry C. Maxwell Elementary School","31, 33",03/24/2024,02/17/2025,868347,600000,0,0,600000,0,0,0,600000,-86.67477,36.033195,Project Line,POINT (-86.67477 36.033195)
5119,Metro Nashville,Metro Public Works,Engineering,21-042013221347,Sidewalk,New Sidewalk,New,Under Construction,,In Progress,Linbar Dr From Harding Pl To Wallace Rd,"Sidewalk, curb & gutter, and grass strip","Project provides neighborhood connectivity to Transit, Restaurants, and Stores on Harding Place",Linbar Dr From Harding Pl To Wallace Rd,"Installation of new sidewalk along with curb, gutter, and storm drainage that provides neighborhood connectivity to Transit, Restaurants, and Stores on Harding Place",30,11/01/2023,05/29/2024,1548948,920374,1572898.75,0,920374,0,0,0,920374,-86.703567,36.083348,Project Line,POINT (-86.703567 36.083348)
7571,Metro Nashville,Metro Public Works,Engineering,22-030712113939,Bikeway,Bike Lane,New,Future,,Future,Broadway From 8th Ave S To 1st Ave S,Potential bike route per WalknBike 2022.,To provide safe connections for people biking to neighborhoods and destinations for transportation and recreation.,Broadway From 8th Ave S To 1st Ave S,This section of Broadway is being evaluated for the feasibility of a bike route.,19,2025,2025,243590,0,0,0,0,0,0,0,243590,-86.777797,36.160772,Project Line,POINT (-86.777797 36.160772)
5120,Metro Nashville,Metro Public Works,Engineering,2016-R-023,Sidewalk,New Sidewalk,New,Ready for Construction,,Scheduled,Tusculum Road (East of Nolensville Pike),6' Sidewalk with 4' Furnishing Zone,Project provides sidewalk network connectivity to Transit and shopping on Nolensville Pike,Tusculum Rd From Nolensville Pike To Brewer Dr,"Installation of new 6' sidewalk and 4' furnishing zone along with curb, gutter, and storm drainage that provides sidewalk network connectivity to Transit and shopping on Nolensville Pike",27,02/15/2024,11/24/2024,4876062.23,2400000,4876061.97,0,2400000,0,0,0,2400000,-86.707324,36.059432,Project Line,POINT (-86.707324 36.059432)
7493,Metro Nashville,Metro Public Works,Engineering,22-022212044591,Sidewalk,New Sidewalk,New,Planning/Scoping,,Planned,Charlotte Pike From American Rd To Oceola Ave,"This project will bridge a sidewalk gap on Charlotte Pike, increasing walkability and pedestrian safety.",To provide safe connections for people walking to neighborhoods and destinations for transportation and recreation.,Charlotte Pike From American Rd To Oceola Ave,Install new sidewalk on south side of Charlotte Pike from American Road to Oceola Avenue. Estimated start in 2024.,20,12/01/2024,06/01/2025,2117148.78,0,0,0,0,0,0,0,2117148.78,-86.865574,36.148655,Project Line,POINT (-86.865574 36.148655)
8346,Metro Nashville,Metro Public Works,Engineering,23-091909585284,Sidewalk,New Sidewalk,New,Construction/Closeout/Warranty,,Complete,31st Ave N Phase 1 From Alley 601 To Alley 700,Construction of a new 5ft sidewalk.,"This project corresponds with the pedestrian safety program currently in construction, and will fill gaps along a busy pedestrian corridor.",31st Ave N From Alley 601 To Alley 700,This project is designed and ready to be constructed.,"21, 24",10/09/2023,10/27/2023,198000,0,0,0,0,0,0,0,198000,-86.816353,36.145141,Project Line,POINT (-86.816353 36.145141)
8322,Metro Nashville,Metro Public Works,Engineering,23-072814011209,Sidewalk,New Sidewalk,New,Planning/Scoping,,Planned,Trousdale Dr From Blackman Rd To Richmar Dr,"Sidewalk, curb and gutter.",Provides connectivity to businesses along Trousdale Dr.,Trousdale Dr From Blackman Rd To Richmar Dr,This project is currently being scoped.,26,02/07/2024,05/06/2024,413750,0,0,0,0,0,0,0,413750,-86.758861,36.077922,Project Line,POINT (-86.758861 36.077922)
7112,Metro Nashville,Metro Public Works,Engineering,21-060708030600,Bikeway,Protected Bike Lane,New,Plan Design,,Planned,Chestnut St From 8th Ave S To Wharf Ave,"Major-marquee bikeway, partially designed and constructed with development",To provide safe connections for people biking to neighborhoods and destinations for transportation and recreation.,Chestnut St From 8th Ave S To Wharf Ave,"A new, protected bikeway is currently in design.",17,"Jan, 2024","Jun, 2024",1200000,501149.28,0,0,306000,0,0,0,501149.28,-86.770395,36.143209,Project Line,POINT (-86.770395 36.143209)
7517,Metro Nashville,Metro Public Works,Engineering,22-022309364127,Sidewalk,New Sidewalk,New,Plan Design,,Planned,Highway 100 From Ace Hardware To Collins Rd,"This project will bridge multiple sidewalk gaps near Highway 100, improving walkability and pedestrian safety.",To provide safe connections for people walking to neighborhoods and destinations for transportation and recreation.,Highway 100 From Ace Hardware To Collins Rd,"Install new sidewalks around intersections of Highway 100, Learning Lane, and Collins Road. Estimated start late 2023.",35,04/09/2024,09/25/2024,385000,0,0,0,0,0,0,0,385000,-86.958498,36.043887,Project Line,POINT (-86.958498 36.043887)
5103,Metro Nashville,Metro Public Works,Engineering,21-042011170829,Sidewalk,New Sidewalk,New,Ready for Construction,,Planned,23rd Avenue North,5' Sidewalk with 4' Furnishing Zone,Project fills gap in sidewalk network and provides connectivity to transit on Clarksville Pike,23RD Ave N From Cass St To St Louis St,"Installation of new 5' sidewalk and 4' furnishing zone along with curb, gutter, and storm drainage that fills gap in sidewalk network and provides connectivity to transit on Clarksville Pike","21, 02",02/01/2024,09/17/2024,1769486,790000,1659803.61,0,790000,0,0,0,790000,-86.814355,36.183138,Project Line,POINT (-86.814355 36.183138)
8358,Metro Nashville,Metro Public Works,Engineering,23-101111100708,Sidewalk,New Sidewalk,New,Plan Design,,Planned,31st Ave N Phase 2 From 719 Aly To Centennial Park Greenway,"This project will connect existing/in progress sidewalk from 31st Ave N to Centennial Park Greenway, increasing walkability and pedestrian safety along this corridor.",To provide safe connections for people walking to neighborhoods and destinations for transportation and recreation.,31st Ave N Phase 2 From 719 Aly To Centennial Park Greenway,This project will connect 31st Ave N to a greenway/walking trail in Centennial Park via 31st Ave N and Parman Pl.,21,01/05/2024,03/04/2024,0,0,0,0,0,0,0,0,0,-86.815827,36.148208,Project Line,POINT (-86.815827 36.148208)
7137,Metro Nashville,Metro Public Works,Engineering,21-060811122818,Bikeway,Buffered Bike Lane,New,Planning/Scoping,,Planned,East Nashville Spokes Project,Construction of a new buffered bike lane.,To provide safe connections for people biking to neighborhoods and destinations for transportation and recreation.,East Nashville Backbone Project,Buffered Bike Lane along various routes in East Nashville.,"06, 19","Jan, 2025","Dec, 2025",1614375,1614375,0,0,287000,0,0,0,1614375,-86.777017,36.167099,Project Line,POINT (-86.777017 36.167099)
7501,Metro Nashville,Metro Public Works,Engineering,22-022215133891,Sidewalk,New Sidewalk,New,Ready for Construction,,Planned,Welshwood Dr From Corning Dr To Nolensville Pike,1082 linear ft of 5ft sidewalk.,This project will extend an existing sidewalk and provide connectivity to local business and transit stops.,Welshwood Dr From Corning Dr To Nolensville Pike,This project met selection criteria due to connectivity and the opportunity for safety improvements.,26,12/28/2023,04/24/2024,212000,0,383721.57,0,0,0,0,0,212000,-86.73089,36.082902,Project Line,POINT (-86.73089 36.082902)
